EVTNAME9900;Japan hands over power to Emperor Bao Dai;;;;;;;;;x
EVTDESC9900;In August, events accelerate: the US drops the two nuclear bombs on Japan and the Soviet Union attacks the Japanese positions in Manchuria - the northern region of China. On the 16th, the Japanese in Vietnam hand over power to Emperor Bao Dai, and on the same day, the Viet Minh proclaimed the creation of a provisional government under the presidency of Uncle Ho.;;;;;;;;;x
EVTOPTA9900;Let them go.;;;;;;;;;x
EVTNAME9901;Communist revolution;;;;;;;;;x
EVTDESC9901;In the next few days, the people of Vietnam began to hold public protests, forcing, on August 30, the Emperor to abdicate. On the same day the Viet Minh proclaimed the Democratic Republic of Vietnam and three days later Uncle Ho gives a speech in Hanoi - Vietnam's main city - to half a million people.;;;;;;;;;x
EVTOPTA9901;This isn't over yet;;;;;;;;;x
EVTNAME9902;Ho Chi Minh Proclames Independence;;;;;;;;;x
EVTDESC9902;On setember 2 of 1945 the Viet Minh proclaimed the Democratic Republic of Vietnam and three days later Uncle Ho gives a speech in Hanoi - Vietnam's main city - to half a million people.;;;;;;;;;x
EVTNAME9910;The Soviet Union call us to do a intervention on Persia;;;;;;;;x
EVTDESC9910;The persian government maybe will support German Reich attaking Soviet Union and British Raj. We can prevent it do a mutual intervention on them with Soviet Union.;;;;;;;;x
EVTOPTA9910A;Let's do it;;;;;;;;x
EVTOPTA9910B;We'll not do it with our other enemies;;;;;;;;x
EVTNAME9911;The United kingdom call us to do a intervention on Persia;;;;;;;;x
EVTDESC9911;The persian government maybe will support German Reich attaking Soviet Union and British Raj. We can prevent it do a mutual intervention on them with United Kingdom.;;;;;;;;x